Course Name,Description,Skills,Majors,Careers
ADA4M - Dramatic Arts,"This course requires students to experiment individually and collaboratively with forms and conventions of both drama and theatre from various cultures and time periods. Students will interpret dramatic literature and other texts and media sources while learning about various theories of directing and acting. Students will examine the significance of dramatic arts in various cultures, and will analyse how the knowledge and skills developed in drama are related to their personal skills, social awareness, and goals beyond secondary school.","Creative Thinking, Collaboration, Critical Analysis, Communication, Cultural Awareness, Social Awareness, Leadership","Drama, Theatre Studies, Acting and Performance Arts, Directing and Cinematic Arts, Cultural Studies, Communication Studies, Education (Arts Education), Media Studies","Actor/Performer, Director (Theatre or Film), Drama Teacher/Arts Educator, Playwright, Theatre Critic, Cultural Program Coordinator, Art Therapist, Media and Communications Specialist"
ASM4M - Media Arts,"This course emphasizes the refinement of media arts skills through the creation of a thematic body of work by applying traditional and emerging technologies, tools, and techniques such as multimedia, computer animation, installation art, and performance art. Students will develop works that express their views on contemporary issues and will create portfolios suitable for use in either career or postsecondary education applications. Students will critically analyse the role of media artists in shaping audience perceptions of identity, culture, and community values.","Media Arts, Multimedia Design, Computer Animation, Installation Art, Performance Art, Portfolio Development, Critical Analysis, Technology Application, Creative Expression, Cultural Awareness","Media Arts, Visual Arts, Animation, Digital Arts, Graphic Design, Art History, Communication Studies, Cultural Studies, Fine Arts","Media Artist, Animator, Multimedia Designer, Graphic Designer, Installation Artist, Performance Artist, Art Director, Cultural Analyst, Educator (Media Arts), Content Creator"
AMI4M / AMK4M / AMR4M / AMU4M - Music,"This course enables students to enhance their musical literacy through the creation, appreciation, analysis, and performance of music. Students will perform traditional, commercial, and art music, and will respond with insight to live and recorded performances. Students will enhance their understanding of the function of music in society and the impact of music on themselves and various communities and cultures. Students will analyse how to apply skills developed in music to their life and careers.","Musical Literacy, Music Creation, Performance, Music Appreciation, Analytical Thinking, Insightful Response to Music, Social Awareness, Cultural Awareness, Self-Reflection, Skill Application","Music, Music Performance, Music Composition, Music Education, Music Therapy, Music History, Music Technology, Arts Management, Cultural Studies","Musician, Composer, Music Teacher, Music Therapist, Music Producer, Sound Engineer, Arts Administrator, Cultural Program Coordinator, Music Critic, Performer"
ATC4M - Dance,"This course emphasizes the development of students technical proficiency, fluency in the language of movement in dance genres from around the world, and understanding of dance science. Students will explain the social, cultural, and historical contexts of dance; apply the creative process through the art of dance in a variety of ways; and exhibit an understanding of the purpose and possibilities of continuing engagement in the arts as a lifelong learner.","Movement Fluency, Dance Technique, Cultural Awareness, Dance Science, Creative Process, Artistic Expression, Lifelong Learning, Social Awareness, Historical Context","Dance, Dance Education, Performing Arts, Dance Therapy, Kinesiology, Movement Studies, Cultural Studies, Anthropology, Theatre Arts","Dancer, Dance Teacher, Choreographer, Dance Therapist, Kinesiologist, Movement Specialist, Dance Critic, Arts Educator, Performance Artist, Cultural Program Coordinator"
AVI3M / AVI4M - Visual Arts,"This course focuses on enabling students to refine their use of the creative process when creating and presenting two- and three-dimensional art works using a variety of traditional and emerging media and technologies. Students will use the critical analysis process to deconstruct art works and explore connections between art and society. The studio program enables students to explore a range of materials, processes, and techniques that can be applied in their own art production. Students will also make connections between various works of art in personal, contemporary, historical, and cultural contexts.","Creative Process, Artistic Expression, Technical Proficiency, Critical Analysis, Deconstruction, Media and Technology Application, Studio Art Production, Material Exploration, Process Exploration, Cultural Awareness, Historical Context, Personal Reflection","Fine Arts, Visual Arts, Art History, Graphic Design, Digital Arts, Art Education, Cultural Studies, Contemporary Art, Sculpture, Photography, Media Arts","Artist, Art Teacher, Art Curator, Art Critic, Graphic Designer, Illustrator, Sculptor, Photographer, Art Director, Digital Media Artist, Museum Educator"
AWD3M / AWD4M - Graphic Design,"Students will study in depth how the elements and principles of design are applied in various art forms. This course will vary from school to school according to the facilities, materials and staffing.","Design Principles, Artistic Composition, Creative Problem Solving, Technical Proficiency, Visual Communication, Material Exploration, Process Exploration","Graphic Design, Visual Arts, Industrial Design, Architecture, Fashion Design, Fine Arts, Interior Design, Digital Arts, Media Arts","Graphic Designer, Industrial Designer, Architect, Fashion Designer, Art Director, Interior Designer, Fine Artist, Digital Media Artist, Illustrator, UI/UX Designer"
AWQ3M / AWQ4M - Photography,Students will learn about traditional photography as an expressive art form. The history of art as it relates to photography will be included and the role of digital imaging and manipulation may be included in the studio projects.,"Photography, Artistic Expression, Digital Imaging, Image Manipulation, Visual Storytelling, Historical Analysis, Technical Photography, Studio Practice","Photography, Visual Arts, Digital Media, Media Arts, Fine Arts, Art History, Communication Arts, Graphic Design","Photographer, Digital Imaging Specialist, Photo Editor, Art Director, Visual Artist, Photography Teacher, Media Production Specialist, Graphic Designer, Photojournalist"
BAF3M / BAT4M - Financial Accounting Principles,"This course introduces students to advanced accounting principles that will prepare them for postsecondary studies in business. Students will learn about financial statements for various forms of business ownership and how those statements are interpreted in making business decisions.This course expands students knowledge of sources of financing, further develops accounting methods for assets, and introduces accounting for partnerships and corporations","Advanced Accounting, Financial Statement Analysis, Business Decision Making, Accounting for Business Ownership, Financial Management, Asset Management, Accounting Methods, Financing Sources, Partnership and Corporate Accounting","Accounting, Business Administration, Finance, Economics, Business Management, Entrepreneurship, International Business, Taxation, Business Analytics","Accountant, Financial Analyst, Business Consultant, Tax Specialist, Auditor, Corporate Finance Specialist, Business Manager, Financial Planner, Entrepreneur"
BBB4M - International Business Fundamentals,"This course provides an overview of the importance of international business and trade in the global economy and explores the factors that influence success in international markets. Students will learn about the techniques and strategies associated with marketing, distribution, and managing international business effectively. This course prepares students for postsecondary programs in business, including international business, marketing, and management.","International Business, Global Trade, Marketing Strategies, Distribution Management, Business Strategy, Cross-Cultural Communication, Economic Analysis, International Market Analysis, Leadership, Negotiation","International Business, Marketing, Business Administration, Economics, International Relations, Business Management, Global Studies, Supply Chain Management","International Business Consultant, Marketing Manager, Supply Chain Manager, International Trade Specialist, Export/Import Manager, Global Business Analyst, Brand Manager, Business Development Manager"
BOH4M - Business Leadership: Management Fundamentals,"This course focuses on the development of leadership skills used in managing a successful business. Students will analyse the role of a leader in business, with a focus on decision making, management of group dynamics,workplace stress and conflict, motivation of employees, and planning. Effective business communication skills, ethics, and social responsibility are also emphasized.","Leadership, Decision Making, Group Dynamics Management, Conflict Resolution, Stress Management, Employee Motivation, Business Communication, Strategic Planning, Ethics, Social Responsibility","Business Administration, Management, Organizational Leadership, Human Resources, Marketing, Business Communication, Entrepreneurship, Business Ethics, Sociology","Business Manager, Leadership Consultant, HR Manager, Operations Manager, Corporate Trainer, Organizational Development Specialist, Business Strategist, Employee Relations Specialist"
CGO4M - Geomatics: Geotechnologies in Action,"This course provides a foundation for students who are considering pursuing a career that requires hands-on knowledge of computer-based spatial technologies. Students will analyse and propose solutions to real-life issues related to spatial organization, such as determining transportation routes, appropriate locations for community services, or potential conservation and preservation areas. Students will extend their ability to use geographic information systems (GIS), global positioning systems (GPS), and remote sensing and to create maps, charts, and graphs. Throughout the course, students will apply the concepts of geographic thinking and the geographic inquiry process to investigate various issues related to spatial organization.","Geographic Information Systems (GIS), Global Positioning Systems (GPS), Remote Sensing, Spatial Analysis, Map Creation, Chart and Graph Creation, Geographic Thinking, Inquiry Process, Problem Solving, Data Interpretation","Geography, Geomatics, Environmental Science, Urban Planning, Civil Engineering, Geography Information Science (GIS), Environmental Studies, Cartography, Spatial Data Science","GIS Analyst, Urban Planner, Cartographer, Environmental Consultant, Remote Sensing Specialist, Transportation Planner, Geospatial Data Analyst, Environmental Researcher, Conservation Specialist"
CGR4M - The Environment and Resource Management,"This course investigates interactions between natural and human systems, with a particular emphasis on the impacts of human activity on ecosystems and natural processes. Students will use the geographic inquiry process, apply the concepts of geographic thinking, and employ a variety of spatial skills and technologies to analyse these impacts and propose ways of reducing them. In the course of their investigations, they will assess resource management and sustainability practices, as well as related government policies and international accords. They will also consider questions of individual responsibility and environmental stewardship as they explore ways of developing a more sustainable relationship with the environment.","Geographic Inquiry, Spatial Analysis, Environmental Impact Assessment, Resource Management, Sustainability Practices, Policy Analysis, Environmental Stewardship, Critical Thinking, Problem Solving, Data Interpretation","Environmental Science, Geography, Urban Planning, Sustainability Studies, Environmental Policy, Natural Resource Management, Ecology, Environmental Studies, Climate Science, Geomatics","Environmental Consultant, Sustainability Specialist, Urban Planner, Resource Manager, Policy Analyst, Environmental Educator, Climate Change Analyst, Conservation Specialist, GIS Analyst, Government Policy Advisor"
CGU4M - World Geography: Urban Patterns and Population Issues,"The world's population is growing, it is moving and intermixing, and it is increasingly found in cities. This course explores these changes and the challenges that come with them. Students will investigate the forces that are shaping the world's communities, the patterns of interaction between these communities, the quality of life within them, and their impact on the world around them. Students will apply the concepts of geographic thinking, the geographic inquiry process, and spatial skills and technologies as they investigate issues related to population change and urban life and propose ways of enhancing the sustainability of communities around the world.","Geographic Inquiry, Spatial Analysis, Population Studies, Urban Planning, Sustainability Analysis, Data Interpretation, Social Research, Community Development, Critical Thinking, Problem Solving","Urban Studies, Geography, Environmental Science, Sociology, Social Work, City Planning, Public Policy, Demography, Sustainable Development, Global Studies","Urban Planner, Demographer, Social Researcher, Sustainability Specialist, City Administrator, Public Policy Advisor, Community Development Coordinator, Environmental Consultant, Population Analyst"
CGW4U - Canadian and World Issues: A Geographic Analysis,"In this course, students will address the challenge of creating a more sustainable and equitable world. They will explore issues involving a wide range of topics, including economic disparities, threats to the environment, globalization, human rights, and quality of life, and analyse government policies, international agreements, and individual responsibilities relating to them. Students will apply the concepts of geographic thinking and the geographic inquiry process, including the use of spatial technologies, to investigate these complex issues and their impacts on natural and human communities around the world.","Geographic Inquiry, Spatial Analysis, Policy Analysis, Critical Thinking, Economic Analysis, Environmental Impact Assessment, Globalization Studies, Human Rights Research, Data Interpretation, Problem Solving","Global Studies, Political Science, International Relations, Sociology, Economics, Environmental Studies, Public Policy, Human Rights, Development Studies, Geography","International Relations Specialist, Policy Analyst, Human Rights Advocate, Sustainability Consultant, Environmental Analyst, Economist, Global Development Coordinator, Public Affairs Advisor, NGO Worker, Government Analyst"
"CHI4U - Canada: History, Identity and Culture","This course traces the history of Canada, with a focus on the evolution of our national identity and culture as well as the identity and culture of various groups that make up Canada. Students will explore various developments and events, both national and international, from precontact to the present, and will examine various communities in Canada and how they have contributed to the development of identity and heritage in Canada. Students will investigate the development of culture and identity, including national identity, in Canada and how and why they have changed throughout the country’s history. They will extend their ability to apply the concepts of historical thinking and the historical inquiry process, including the interpretation and analysis of evidence, as they investigate the people, events, and forces that have shaped Canada.","Historical Thinking, Historical Inquiry, Evidence Analysis, Critical Thinking, Cultural Studies, Identity Research, Social Research, Data Interpretation, Event Analysis, Community Studies","History, Canadian Studies, Sociology, Anthropology, Political Science, Cultural Studies, Social Studies, Indigenous Studies, Heritage Conservation, Education","Historian, Archivist, Museum Curator, Cultural Analyst, Social Researcher, Educator, Public Policy Analyst, Heritage Consultant, Indigenous Affairs Specialist, Government Researcher"
CHY4U - World History: The West and the World,"This course traces major developments and events in world history since approximately 1450. Students will explore social, economic, and political changes, the historical roots of contemporary issues, and the role of conflict and cooperation in global interrelationships. They will extend their ability to apply the concepts of historical thinking and the historical inquiry process, including the interpretation and analysis of evidence, as they investigate key issues and ideas and assess societal progress or decline in world history.","Historical Thinking, Historical Inquiry, Social Analysis, Economic Analysis, Political Analysis, Conflict Resolution, Critical Thinking, Global Studies, Evidence Interpretation, Issue Assessment","History, International Relations, Political Science, Sociology, Global Studies, Economics, Anthropology, Peace and Conflict Studies, International Development, Cultural Studies","Historian, Diplomat, International Relations Specialist, Policy Analyst, Sociologist, Economist, Peace Negotiator, NGO Worker, International Development Expert, Educator"
CIA4U - Analysing Current Economic Issues,"This course examines current Canadian and international economic issues, developments, policies, and practices from diverse perspectives. Students will explore the decisions that individuals and institutions, including governments, make in response to economic issues such as globalization, trade agreements, economic inequalities, regulation, and public spending. Students will apply the concepts of economic thinking and the economic inquiry process, as well as economic models and theories, to investigate, and develop informed opinions about, economic trade-offs, growth, and sustainability and related economic issues.","Economic Analysis, Critical Thinking, Policy Analysis, Globalization Studies, Trade Analysis, Economic Modelling, Decision-Making, Public Spending Analysis, Sustainability Assessment, Regulatory Analysis","Economics, International Business, Public Policy, Political Science, Business Administration, Development Studies, Global Studies, Finance, Trade and Commerce, Environmental Economics","Economist, Policy Analyst, International Trade Specialist, Business Consultant, Financial Analyst, Public Sector Consultant, Sustainability Consultant, Economic Researcher, Government Economist, Global Affairs Specialist"
CLN4U - Canadian and International Law,"This course explores a range of contemporary legal issues and how they are addressed in both Canadian and international law. Students will develop an understanding of the principles of Canadian and international law and of issues related to human rights and freedoms, conflict resolution, and criminal, environmental, and workplace law, both in Canada and internationally. Students will apply the concepts of legal thinking and the legal studies inquiry process, and will develop legal reasoning skills, when investigating these and other issues in both Canadian and international contexts.","Legal Reasoning, Critical Thinking, Human Rights Analysis, Conflict Resolution, Criminal Law, Environmental Law, Workplace Law, International Law, Legal Research, Legal Writing, Case Analysis","Law, Political Science, International Relations, Human Rights, Environmental Studies, Criminal Justice, Public Policy, Sociology, Legal Studies, Conflict Resolution","Lawyer, Legal Advisor, Human Rights Advocate, Criminal Defense Attorney, Corporate Lawyer, Environmental Lawyer, Policy Analyst, International Relations Specialist, Mediator, Judge, Legal Researcher"
CPW4U - Canadian and World Politics,"This course explores various perspectives on issues in Canadian and world politics. Students will explore political decision making and ways in which individuals, stakeholder groups, and various institutions, including governments, multinational corporations, and non-governmental organizations, respond to and work to address domestic and international issues. Students will apply the concepts of political thinking and the political inquiry process to investigate issues, events, and developments of national and international political importance, and to develop and communicate informed opinions about them.","Political Analysis, Critical Thinking, Policy Analysis, Decision Making, Research, Communication, Advocacy, Negotiation, International Relations, Political Strategy, Stakeholder Engagement","Political Science, International Relations, Public Policy, Law, Sociology, History, Economics, Public Administration, Global Studies, Governance","Politician, Political Analyst, Public Policy Consultant, Diplomat, Lobbyist, Political Advisor, NGO Worker, International Relations Specialist, Public Relations Manager, Government Official, Diplomatic Service Officer"
ENG3U / ENG4U - English,"This course emphasizes the consolidation of the literacy, communication, and critical and creative thinking skills necessary for success in academic and daily life. Students will analyse a range of challenging literary texts from various periods, countries, and cultures; interpret and evaluate informational and graphic texts; and create oral, written, and media texts in a variety of forms. An important focus will be on using academic language coherently and confidently, selecting the reading strategies best suited to particular texts and particular purposes for reading, and developing greater control in writing. The course is intended to prepare students for university, college, or the workplace.","Literacy, Communication, Critical Thinking, Creative Thinking, Reading Strategies, Writing Skills, Media Literacy, Oral Communication, Academic Language Proficiency, Textual Analysis, Evaluation of Information","English, Literature, Communications, Media Studies, Linguistics, Education, Creative Writing, Journalism, Rhetoric, Public Relations","Writer, Editor, Journalist, Public Relations Specialist, Communications Consultant, Teacher, Copywriter, Content Creator, Media Specialist, Publishing Professional"
ETS4U - Studies in Literature,"This course is for students with a special interest in literature and literary criticism. The course may focus on themes, genres, time periods, or countries. Students will analyse a range of forms and stylistic elements of literary texts and respond personally, critically, and creatively to them. They will also assess critical interpretations, write analytical essays, and complete an independent study project.","Literary Analysis, Critical Thinking, Creative Response, Writing Skills, Literary Criticism, Research, Essay Writing, Independent Study, Textual Analysis","English, Literature, Comparative Literature, Cultural Studies, Creative Writing, Philosophy, History, Education","Literary Critic, Editor, Teacher, Researcher, Writer, Journalist, Publishing Professional, Academic, Content Creator, Translator"
EWC4U - The Writer’s Craft,"This course emphasizes knowledge and skills related to the craft of writing. Students will analyse models of effective writing; use a workshop approach to produce a range of works; identify and use techniques required for specialized forms of writing; and identify effective ways to improve the quality of their writing. They will also complete a major paper as part of a creative or analytical independent study project, and investigate opportunities for publication and for writing careers.","Writing Skills, Creative Writing, Analytical Writing, Editing, Research, Independent Study, Workshop Techniques, Peer Review, Writing Improvement, Publishing","English, Creative Writing, Journalism, Communications, Media Studies, Publishing, Professional Writing, Literature, Education","Writer, Editor, Journalist, Publisher, Content Creator, Copywriter, Technical Writer, Communications Specialist, Researcher, Creative Director"
FEF4U - Extended French,"This course further emphasizes the consolidation of communication skills required to interact in French for various purposes about concrete and abstract topics. Students will independently apply language learning strategies in a variety of real-life and personally relevant contexts in listening, speaking, reading, and writing, and will broaden their creative and critical thinking skills through responding to and analysing oral and written texts. Students will increase their knowledge of the French language through the study of Canadian and international French literature. They will also enrich their understanding and appreciation of diverse French-speaking communities, and will develop skills necessary for lifelong language learning.","Language Learning, Listening, Speaking, Reading, Writing, Critical Thinking, Creative Thinking, Text Analysis, Cultural Appreciation, Independent Learning, Communication","French Studies, Linguistics, Translation, Education, International Studies, Cultural Studies, Communication, Literature","Translator, Interpreter, Language Teacher, Content Creator, Diplomat, Cultural Advisor, International Relations Specialist, Tourism Specialist, Bilingual Customer Service Representative"
