Course Name,Description,Skills,Majors,Careers
FIF4U - French Immersion,"This course provides students with extensive opportunities to communicate, interact, and think critically and creatively in French. Students will consolidate their listening, speaking, reading, and writing skills and apply language learning strategies while communicating about concrete and abstract topics, and will independently respond to and interact with a variety of oral and written texts. Students will study a selection of French literature from the Middle Ages to the present. They will also enrich their understanding and appreciation of diverse French-speaking communities, and will develop skills necessary for lifelong language learning.","Language Learning, Listening, Speaking, Reading, Writing, Critical Thinking, Creative Thinking, Text Analysis, Cultural Appreciation, Independent Learning, Communication","French Studies, Linguistics, Translation, Education, International Studies, Cultural Studies, Communication, Literature","Translator, Interpreter, Language Teacher, Content Creator, Diplomat, Cultural Advisor, International Relations Specialist, Tourism Specialist, Bilingual Customer Service Representative"
FSF3U / FSF4U - Core French,"This course provides extensive opportunities for students to speak and interact in French independently. Students will develop their listening, speaking, reading, and writing skills, apply language learning strategies in a wide variety of real-life situations, and develop their creative and critical thinking skills through responding to and interacting with a variety of oral and written texts. They will also enrich their understanding and appreciation of diverse French-speaking communities, and will develop skills necessary for lifelong language learning.","Language Learning, Listening, Speaking, Reading, Writing, Critical Thinking, Creative Thinking, Text Interaction, Cultural Appreciation, Independent Learning","French Studies, Linguistics, Education, International Studies, Cultural Studies, Communication, Literature","Translator, Interpreter, Language Teacher, Content Creator, Diplomat, Cultural Advisor, International Relations Specialist, Tourism Specialist, Bilingual Customer Service Representative"
HFA4U - Nutrition and Health,"This course examines the relationships between food, energy balance, and nutritional status; the nutritional needs of individuals at different stages of life; and the role of nutrition in health and disease. Students will evaluate nutrition-related trends and will determine how food choices can promote food security and environmental responsibility. Students will learn about healthy eating, expand their repertoire of food-preparation techniques, and develop their social science research skills by investigating issues related to nutrition and health.","Nutritional Analysis, Food Preparation, Research Skills, Critical Thinking, Social Science Research, Health Evaluation, Food Security Awareness, Environmental Responsibility","Nutrition, Dietetics, Public Health, Kinesiology, Food Science, Health Science, Environmental Science, Sociology","Nutritionist, Dietitian, Health Educator, Food Scientist, Public Health Specialist, Social Researcher, Environmental Consultant, Healthcare Worker, Wellness Coach"
HHG4M - Human Development throughout the Lifespan,"This course offers a multidisciplinary approach to the study of human development throughout the lifespan. Students will learn about a range of theoretical perspectives on human development. They will examine threats to healthy development as well as protective factors that promote resilience. Students will learn about physical, cognitive, and social-emotional development from the prenatal period through old age and will develop their research and inquiry skills by investigating issues related to human development.","Research Skills, Inquiry Skills, Critical Thinking, Developmental Analysis, Resilience Building, Cognitive Development, Social-Emotional Development, Lifespan Analysis","Psychology, Sociology, Social Work, Human Development, Nursing, Education, Public Health, Gerontology","Psychologist, Social Worker, Counselor, Educator, Researcher, Health Specialist, Child Development Specialist, Gerontologist, Healthcare Worker"
HHS4U - Families in Canada,"This course enables students to draw on sociological, psychological, and anthropological theories and research to analyse the development of individuals, intimate relationships, and family and parent-child relationships. Students will focus on issues and challenges facing individuals and families in Canada’s diverse society. They will develop analytical tools that enable them to assess various factors affecting families and to consider policies and practices intended to support families in Canada. They will develop the investigative skills required to conduct and communicate the results of research on individuals, intimate relationships, and parent-child relationships.","Analytical Skills, Research Skills, Investigative Skills, Critical Thinking, Communication Skills, Policy Analysis, Family Dynamics Analysis, Sociological and Psychological Analysis","Sociology, Psychology, Anthropology, Social Work, Family Studies, Human Development, Public Health, Education, Social Policy","Sociologist, Psychologist, Family Therapist, Social Worker, Researcher, Counselor, Educator, Policy Analyst, Family Support Worker"
HNB4M - The World of Fashion,"This course gives students the opportunity to explore the world of fashion. Students will learn how to create a fashion product using various tools, techniques and technologies while developing their practical skills. Students will learn about various factors that affect the global fashion industry, the needs of specialized markets, and the impact of fibre and fabric production and care. In addition, they will learn about social and historical influences on fashion. Students will apply research skills when investigating aspects of the fashion world.","Practical Skills, Research Skills, Design Skills, Technical Skills, Critical Thinking, Problem Solving, Fabric and Fibre Knowledge, Fashion Product Creation","Fashion Design, Textile Science, Fashion Marketing, Merchandising, Fashion Technology, Art and Design, Industrial Design, Cultural Studies","Fashion Designer, Textile Scientist, Fashion Merchandiser, Fashion Buyer, Fashion Consultant, Product Developer, Costume Designer, Fashion Researcher, Trend Forecaster, Fashion Stylist"
HSB4U - Challenge and Change in Society,"This course focuses on the use of social science theories, perspectives, and methodologies to investigate and explain shifts in knowledge, attitudes, beliefs, and behaviour and their impact on society. Students will critically analyse how and why cultural, social, and behavioural patterns change over time. They will explore the ideas of social theorists and use those ideas to analyse causes of and responses to challenges such as technological change, deviance, and global inequalities. Students will explore ways in which social science research methods can be used to study social change.","Critical Thinking, Analytical Skills, Research Skills, Social Science Methodologies, Behavioral Analysis, Sociological Analysis, Problem Solving, Theoretical Application","Sociology, Social Science, Anthropology, Psychology, Political Science, Social Work, Criminology, Global Studies, Gender Studies","Sociologist, Social Worker, Research Analyst, Policy Analyst, Criminologist, Public Health Researcher, Social Science Educator, Global Development Specialist, Behavior Analyst"
HSC4M - World Cultures,"This course examines the nature of culture; how cultural identities are acquired, maintained, and transformed; and theories used to analyse cultures. Students will explore world cultures, with an emphasis on the analysis of religious and spiritual beliefs, art forms, and philosophy. They will study the contributions and influence of a range of cultural groups and will critically analyse issues facing ethnocultural groups within Canada and around the world. Students will develop and apply research skills and will design and implement a social action initiative relating to cultural diversity.","Cultural Analysis, Critical Thinking, Research Skills, Social Action Planning, Problem Solving, Cross-Cultural Communication, Theoretical Application, Sociological Analysis","Cultural Studies, Anthropology, Sociology, History, Religious Studies, Philosophy, Global Studies, Social Work, Political Science, International Relations","Cultural Anthropologist, Sociologist, Policy Analyst, Diversity Consultant, Social Action Organizer, International Relations Specialist, Cultural Researcher, Community Outreach Coordinator, Educator, Ethnographer"
HSE4M - Equity and Social Justice: From Theory to Practice,"This course enables students to develop an understanding of the theoretical, social, and historical underpinnings of various equity and social justice issues and to analyse strategies for bringing about positive social change. Students will learn about historical and contemporary equity and social justice issues in Canada and globally. They will explore power relations and the impact of a variety of factors on equity and social justice. Students will develop and apply research skills and will design and implement a social action initiative relating to an equity or social justice issue.","Critical Thinking, Research Skills, Social Justice Advocacy, Social Change Strategy, Power Relations Analysis, Problem Solving, Equity Analysis, Community Engagement, Social Action Planning, Public Speaking","Social Justice Studies, Sociology, Political Science, History, Gender Studies, Law, Social Work, Human Rights, Global Studies, Public Policy","Social Justice Advocate, Community Organizer, Policy Analyst, Human Rights Specialist, Social Researcher, Public Policy Consultant, Nonprofit Leader, Equity Consultant, Social Work Practitioner, Activist"
HZT4U - Philosophy: Questions and Theories,"This course enables students to acquire an understanding of the nature of philosophy and philosophical reasoning skills and to develop and apply their knowledge and skills while exploring specialized branches of philosophy (the course will cover at least three of the following branches: metaphysics, ethics, epistemology, philosophy of science, social and political philosophy, aesthetics). Students will develop critical thinking and philosophical reasoning skills as they formulate and evaluate arguments related to a variety of philosophical questions and theories. They will also develop research and inquiry skills related to the study and practice of philosophy.","Philosophical Reasoning, Critical Thinking, Argument Formulation, Ethical Analysis, Research Skills, Inquiry Skills, Analytical Thinking, Conceptual Analysis, Problem-Solving, Debate Skills","Philosophy, Political Science, Ethics, History, Law, Sociology, Cognitive Science, Religious Studies, Logic, Psychology","Philosopher, Ethics Consultant, Political Theorist, Law Professor, Academic Researcher, Public Policy Analyst, Corporate Ethics Officer, Human Rights Advocate, Legislative Assistant, Political Analyst"
ICS3U / ICS4U - Computer Science,"This course enables students to further develop knowledge and skills in computer science. Students will use modular design principles to create complex and fully documented programs, according to industry standards. Student teams will manage a large software development project, from planning through to project review. Students will also analyse algorithms for effectiveness. They will investigate ethical issues in computing and further explore environmental issues, emerging technologies, areas of research in computer science, and careers in the field.","Modular Design, Software Development, Programming, Project Management, Algorithm Analysis, Ethical Reasoning, Critical Thinking, Problem Solving, Team Collaboration, Documentation, Research Skills","Computer Science, Software Engineering, Information Technology, Artificial Intelligence, Data Science, Cybersecurity, Computer Engineering, Systems Engineering, Applied Computing, Information Systems","Software Developer, Systems Analyst, Project Manager, Data Scientist, Computer Programmer, Software Engineer, IT Consultant, Cybersecurity Specialist, Research Scientist, Technical Writer"
IDC4U/IDP4U - Interdisciplinary Studies,"This course will help students develop and consolidate the skills required for and knowledge of different subjects and disciplines to solve problems, make decisions, create personal meaning, and present findings beyond the scope of a single subject or discipline. Students will apply the principles and processes of inquiry and research to effectively use a range of print, electronic, and mass media resources; to analyse historical innovations and exemplary research; and to investigate real-life situations and career opportunities in interdisciplinary endeavours. They will also assess their own cognitive and affective strategies, apply general skills in both familiar and new contexts, create innovative products, and communicate new knowledge.","Problem Solving, Decision Making, Research Skills, Inquiry Process, Critical Thinking, Communication Skills, Cognitive Strategy Assessment, Creative Thinking, Innovation, Media Literacy, Interdisciplinary Thinking, Self-reflection","Interdisciplinary Studies, Cognitive Science, Research Methodology, Liberal Arts, Humanities, Social Sciences, Communications, Innovation Studies, Information Science, Education, Business","Research Analyst, Consultant, Educator, Project Manager, Policy Advisor, Media Specialist, Communications Specialist, Innovation Consultant, Data Scientist, Entrepreneur"
LVV4U - Classical Civilization,"This course introduces students to the rich cultural legacy of the Classical world and encourages them to make connections between antiquity and other societies and to their own personal experiences. Students will investigate such aspects of Classical culture as its mythology and literature, art, architecture, philosophy, science, and technology, as well as elements of the ancient Greek and Latin languages. By reading Classical authors in English translation and examining material culture brought to light through archaeology, students will enhance both their communication skills and their ability to think critically and creatively. In addition, they will be encouraged to be culturally sensitive, independent learners who appreciate the interconnectedness of ancient and modern societies and who will be able to apply this understanding to their future endeavours.","Critical Thinking, Creative Thinking, Communication Skills, Cultural Sensitivity, Independent Learning, Research Skills, Analytical Thinking, Interdisciplinary Thinking, Problem Solving","Classical Studies, Archaeology, History, Philosophy, Literature, Anthropology, Cultural Studies, Linguistics, Art History, Humanities","Historian, Archaeologist, Museum Curator, Educator, Archaeological Consultant, Writer, Translator, Cultural Heritage Specialist, Museum Educator, Researcher"
MCR3U - Functions,"This course introduces the mathematical concept of the function by extending students experiences with linear and quadratic relations. Students will investigate properties of discrete and continuous functions, including trigonometric and exponential functions; represent functions numerically, algebraically, and graphically; solve problems involving applications of functions; investigate inverse functions; and develop facility in determining equivalent algebraic expressions. Students will reason mathematically and communicate their thinking as they solve multi-step problems.","Mathematical Reasoning, Problem Solving, Algebraic Manipulation, Graphical Representation, Logical Thinking, Communication of Mathematical Ideas, Multi-step Problem Solving, Critical Thinking, Analytical Thinking","Mathematics, Engineering, Physics, Computer Science, Actuarial Science, Economics, Data Science, Statistics, Finance, Applied Mathematics","Mathematician, Engineer, Data Analyst, Financial Analyst, Computer Scientist, Actuary, Researcher, Statistician, Economist, Software Developer"
MCV4U - Calculus and Vectors,"This course builds on students previous experience with functions and their developing understanding of rates of change. Students will solve problems involving geometric and algebraic representations of vectors and representations of lines and planes in three-dimensional space; broaden their understanding of rates of change to include the derivatives of polynomial, sinusoidal, exponential, rational, and radical functions; and apply these concepts and skills to the modelling of real-world relationships. Students will also refine their use of the mathematical processes necessary for success in senior mathematics. This course is intended for students who choose to pursue careers in fields such as science, engineering, economics, and some areas of business, including those students who will be required to take a university-level calculus, linear algebra, or physics course.","Problem Solving, Geometric Representation, Algebraic Representation, Understanding Rates of Change, Derivative Calculation, Mathematical Modelling, Linear Algebra, Mathematical Communication, Real-World Application of Functions, Analytical Thinking, Critical Thinking","Mathematics, Engineering, Physics, Economics, Computer Science, Business, Actuarial Science, Data Science, Applied Mathematics, Environmental Science, Finance, Operations Research","Scientist, Engineer, Economist, Mathematician, Financial Analyst, Data Analyst, Software Developer, Researcher, Actuary, Operations Manager"
MDM4U - Mathematics of Data Management,"This course broadens students understanding of mathematics as it relates to managing data. Students will apply methods for organizing and analysing large amounts of information; solve problems involving probability and statistics; and carry out a culminating investigation that integrates statistical concepts and skills. Students will also refine their use of the mathematical processes necessary for success in senior mathematics. Students planning to enter university programs in business, the social sciences, and the humanities will find this course of particular interest.","Data Organization, Data Analysis, Probability, Statistics, Problem Solving, Statistical Investigation, Mathematical Communication, Critical Thinking, Analytical Thinking, Mathematical Modelling","Business, Social Sciences, Humanities, Psychology, Sociology, Economics, Political Science, Marketing, Education, History","Business Analyst, Statistician, Data Analyst, Economist, Social Researcher, Market Research Analyst, Human Resources Specialist, Policy Analyst, Educator"
MHF4U - Advanced Functions,"This course extends students experience with functions. Students will investigate the properties of polynomial, rational, logarithmic, and trigonometric functions; develop techniques for combining functions; broaden their understanding of rates of change; and develop facility in applying these concepts and skills. Students will also refine their use of the mathematical processes necessary for success in senior mathematics. This course is intended both for students taking the Calculus and Vectors course as a prerequisite for a university program and for those wishing to consolidate their understanding of mathematics before proceeding to any one of a variety of university programs.","Function Analysis, Mathematical Modelling, Rates of Change, Problem Solving, Function Combination, Algebraic Manipulation, Trigonometric Function Analysis, Logarithmic Function Analysis, Critical Thinking, Mathematical Communication, Mathematical Processes","Mathematics, Engineering, Computer Science, Physics, Economics, Finance, Architecture, Chemistry, Biology, Data Science","Engineer, Data Scientist, Mathematician, Financial Analyst, Statistician, Architect, Researcher, Software Developer, Economist, Physicist"
"NDG4M - First Nations, Métis and Inuit Governance in Canada","This course explores aspects of First Nations, Métis, and Inuit leadership, nationhood, and governance. Students will investigate historical and contemporary approaches of First Nations, Métis, and Inuit peoples to relations with, and negotiations within, government structures in Canada. Students will examine how traditional values and cultures inform various models of Aboriginal governance, and will reflect on their own ideas about legal, political, civic, economic, and cultural leadership as they explore diverse governance strategies being used to revitalize and strengthen First Nations, Métis, and Inuit self-determination throughout Canada.","Leadership Analysis, Political Science, Indigenous Governance, Cultural Awareness, Critical Thinking, Historical Analysis, Civic Engagement, Negotiation Skills, Self-Reflection, Research Skills","Indigenous Studies, Political Science, Law, Public Administration, Sociology, History, Social Justice, Anthropology, Education, Environmental Studies","Indigenous Rights Advocate, Public Policy Analyst, Community Leader, Legal Advisor, Social Worker, Government Official, Educator, Cultural Consultant, Researcher, Non-Profit Manager"
NDW4M - Contemporary Indigenous Issues and Perspectives in a Global Context,"This course examines global issues from the perspectives of indigenous peoples. Students will explore the depth and diversity of indigenous cultures, traditions, and knowledge. Students will consider how diverse indigenous communities persevere despite current global environmental and economic trends, and will investigate topics such as identity, social justice, human rights and abuses, spirituality, resistance, and advocacy for change.","Cultural Awareness, Social Justice, Critical Thinking, Research Skills, Advocacy, Historical Analysis, Environmental Analysis, Global Perspectives, Identity Exploration, Human Rights Advocacy, Resistance Strategies","Indigenous Studies, Sociology, Anthropology, Political Science, Global Studies, Human Rights, Environmental Studies, Social Justice, History, International Relations","Human Rights Advocate, Social Justice Advocate, Environmental Consultant, Researcher, Policy Analyst, Educator, Non-Profit Manager, Cultural Consultant, International Relations Specialist, Community Organizer"
PLF4M - Recreation and Healthy Active Living Leadership,"This course enables students to explore the benefits of lifelong participation in active recreation and healthy leisure and to develop the leadership and coordinating skills needed to plan, organize, and to safely implement recreational events and other activities related to healthy, active living. Students will also learn how to promote the benefits of healthy, active living to others through mentoring and assisting them in making informed decisions that enhance their well-being. The course will prepare students for university programs in physical education and health and kinesiology and for college and university programs in recreation and leisure management, fitness and health promotion, and fitness leadership.","Leadership, Event Planning, Health Promotion, Active Living, Mentoring, Coordination, Safe Activity Implementation, Public Speaking, Wellness Advocacy, Time Management, Teamwork","Physical Education, Health and Kinesiology, Recreation and Leisure Management, Fitness and Health Promotion, Fitness Leadership, Public Health, Sports Science","Recreation Coordinator, Fitness Instructor, Health Promotion Specialist, Wellness Coach, Event Planner, Sports Manager, Physical Education Teacher, Leisure Manager, Kinesiologist, Fitness and Health Advocate"
PSK4U - Introductory Kinesiology,"This course focuses on the study of human movement and of systems, factors and principles involved in human development. Students will learn about the effects of physical activity on health and performance, the evolution of physical activity and sport, and the physiological, psychological, and social factors that influence an individual's participation in physical activity and sport. The course prepares students for university programs in physical education and health, kinesiology, health sciences, health studies, recreation, and sports administration.","Human Movement Analysis, Physiological Analysis, Psychological Analysis, Social Factors in Sports, Health and Performance Evaluation, Research Skills, Communication, Critical Thinking, Time Management, Teamwork, Event Planning","Physical Education, Health and Kinesiology, Health Sciences, Health Studies, Sports Administration, Recreation, Public Health, Exercise Science, Sports Science","Kinesiologist, Sports Administrator, Physical Education Teacher, Health and Fitness Coach, Health Educator, Exercise Physiologist, Sports Psychologist, Recreation Manager, Athletic Trainer, Wellness Consultant"
